?abs=0x1629a = 0x00000000
?abs=0x16292 = 0x00000000
?abs=0x16282 = 0x0000001a
regRLC_SAFE_MODE = 0x00000003
regRLC_PG_CNTL = 0x00000000
regRLC_SAFE_MODE = 0x00000001
regRLC_SAFE_MODE = 0x00000003
regRLC_CGCG_CGLS_CTRL = 0x0000363c
regSDMA0_RLC_CGCG_CTRL = 0x00400000
regRLC_CGTT_MGCG_OVERRIDE = 0x000600e6
regRLC_CGTT_MGCG_OVERRIDE = 0x000602e6
regRLC_CGTT_MGCG_OVERRIDE = 0x000603e6
regRLC_CGTT_MGCG_OVERRIDE = 0x000607e6
regCP_INT_CNTL_RING0 = 0x85c00000
regRLC_SAFE_MODE = 0x00000001
?abs=0x117b = 0xf8000000
?abs=0x1a6cd = 0x00080200
?abs=0x1a6cd = 0x00000200
?abs=0xcd7 = 0xd3e01588
?abs=0xcd7 = 0xd3e01508
?abs=0x4460118 = 0xbea0ca1c
?abs=0x446001c = 0x0e000000
?abs=0x4460187 = 0x00000000
?abs=0xff8 = 0x0c00000f
?abs=0xff4 = 0x58505850
?abs=0xff8 = 0x0000000f
?abs=0xff8 = 0xfc00000f
?abs=0x53d5 = 0x01010101
?abs=0x53d5 = 0x01010100
?abs=0x53d5 = 0x01000100
?abs=0x53dd = 0x00010001
?abs=0x53dd = 0x00010000
?abs=0x53dd = 0x00000000
?abs=0x53e5 = 0x01010101
?abs=0x53e5 = 0x01010100
?abs=0x53e5 = 0x01000100
?abs=0x53ed = 0x01010101
?abs=0x53ed = 0x01010100
?abs=0x53ed = 0x01000100
?abs=0x53f5 = 0x01010101
?abs=0x53f5 = 0x01010100
?abs=0x53f5 = 0x01000100
?abs=0x53d5 = 0x01100100
?abs=0x53d5 = 0x00000100
?abs=0x53e5 = 0x01100100
?abs=0x53e5 = 0x00000100
?abs=0x53ed = 0x01100100
?abs=0x53ed = 0x00000100
?abs=0x53f5 = 0x01100100
?abs=0x53f5 = 0x00000100
regSDMA0_CNTL = 0x00002441
regSDMA0_QUEUE0_RB_CNTL = 0x00841816
regSDMA0_QUEUE0_IB_CNTL = 0x00000100
regSDMA0_F32_CNTL = 0x08084001
regCP_INT_CNTL_RING0 = 0x85400000
regCP_ME1_PIPE0_INT_CNTL = 0x05000000
regCP_ME1_PIPE1_INT_CNTL = 0x05000000
regCP_ME1_PIPE2_INT_CNTL = 0x05000000
regCP_ME1_PIPE3_INT_CNTL = 0x05000000
regCP_INT_CNTL_RING0 = 0x85000000
regCP_INT_CNTL_RING0 = 0x84000000
regCP_ME1_PIPE0_INT_CNTL = 0x04000000
regCP_ME1_PIPE1_INT_CNTL = 0x04000000
regCP_ME1_PIPE2_INT_CNTL = 0x04000000
regCP_ME1_PIPE3_INT_CNTL = 0x04000000
regGRBM_GFX_CNTL = 0x0000000c
regCP_HQD_DEQUEUE_REQUEST = 0x00000001
regCP_HQD_PQ_DOORBELL_CONTROL = 0x80000002
regCP_HQD_PQ_DOORBELL_CONTROL = 0x00000000
regCP_HQD_PQ_WPTR_LO = 0x00000000
regCP_HQD_PQ_WPTR_HI = 0x00000000
regCP_HQD_PQ_RPTR = 0x00000000
regGRBM_GFX_CNTL = 0x00000000
regCP_MES_CNTL = 0x40030010
regCP_ME_CNTL = 0x14000000
regCP_MEC_CNTL = 0x50000000
regCP_INT_CNTL_RING0 = 0x84000000
regGCVM_CONTEXT0_CNTL = 0x00000000
regGCVM_CONTEXT1_CNTL = 0x00000000
regGCVM_CONTEXT2_CNTL = 0x00000000
regGCVM_CONTEXT3_CNTL = 0x00000000
regGCVM_CONTEXT4_CNTL = 0x00000000
regGCVM_CONTEXT5_CNTL = 0x00000000
regGCVM_CONTEXT6_CNTL = 0x00000000
regGCVM_CONTEXT7_CNTL = 0x00000000
regGCVM_CONTEXT8_CNTL = 0x00000000
regGCVM_CONTEXT9_CNTL = 0x00000000
regGCVM_CONTEXT10_CNTL = 0x00000000
regGCVM_CONTEXT11_CNTL = 0x00000000
regGCVM_CONTEXT12_CNTL = 0x00000000
regGCVM_CONTEXT13_CNTL = 0x00000000
regGCVM_CONTEXT14_CNTL = 0x00000000
regGCVM_CONTEXT15_CNTL = 0x00000000
regGCMC_VM_MX_L1_TLB_CNTL = 0x00001818
regGCVM_L2_CNTL = 0x00080e00
regGCVM_L2_CNTL3 = 0x00000000
?abs=0x112c = 0x00000000
?abs=0x1161 = 0x00000008
?abs=0x1120 = 0x40310120
?abs=0x1123 = 0x00000000
?abs=0x1124 = 0x00000000
?abs=0x1a740 = 0x00000001
?abs=0x1a741 = 0x00555407
?abs=0x1a742 = 0x00555407
?abs=0x1a743 = 0x00555407
?abs=0x1a744 = 0x00555407
?abs=0x1a745 = 0x00555407
?abs=0x1a746 = 0x00555407
?abs=0x1a747 = 0x00555407
?abs=0x1a748 = 0x00555407
?abs=0x1a749 = 0x00555407
?abs=0x1a74a = 0x00555407
?abs=0x1a74b = 0x00555407
?abs=0x1a74c = 0x00555407
?abs=0x1a74d = 0x00555407
?abs=0x1a74e = 0x00555407
?abs=0x1a74f = 0x00555407
regGCVM_CONTEXT0_CNTL = 0x00000000
regGCVM_CONTEXT1_CNTL = 0x00000000
regGCVM_CONTEXT2_CNTL = 0x00000000
regGCVM_CONTEXT3_CNTL = 0x00000000
regGCVM_CONTEXT4_CNTL = 0x00000000
regGCVM_CONTEXT5_CNTL = 0x00000000
regGCVM_CONTEXT6_CNTL = 0x00000000
regGCVM_CONTEXT7_CNTL = 0x00000000
regGCVM_CONTEXT8_CNTL = 0x00000000
regGCVM_CONTEXT9_CNTL = 0x00000000
regGCVM_CONTEXT10_CNTL = 0x00000000
regGCVM_CONTEXT11_CNTL = 0x00000000
regGCVM_CONTEXT12_CNTL = 0x00000000
regGCVM_CONTEXT13_CNTL = 0x00000000
regGCVM_CONTEXT14_CNTL = 0x00000000
regGCVM_CONTEXT15_CNTL = 0x00000000
?abs=0x1a740 = 0x00000000
?abs=0x1a741 = 0x00000000
?abs=0x1a742 = 0x00000000
?abs=0x1a743 = 0x00000000
?abs=0x1a744 = 0x00000000
?abs=0x1a745 = 0x00000000
?abs=0x1a746 = 0x00000000
?abs=0x1a747 = 0x00000000
?abs=0x1a748 = 0x00000000
?abs=0x1a749 = 0x00000000
?abs=0x1a74a = 0x00000000
?abs=0x1a74b = 0x00000000
?abs=0x1a74c = 0x00000000
?abs=0x1a74d = 0x00000000
?abs=0x1a74e = 0x00000000
?abs=0x1a74f = 0x00000000
?abs=0x1a8f3 = 0x00001818
?abs=0x1a700 = 0x00080e00
?abs=0x1a702 = 0x00000000
?abs=0xde0 = 0x00000000
?abs=0xe15 = 0x00000000
?abs=0x1629a = 0x00000000
?abs=0x16292 = 0x00000002
?abs=0x16282 = 0x00000011
?abs=0xc = 0x0006a3b0
?abs=0xc = 0x0006a3b4
?abs=0x3935 = 0x00008000
?abs=0x3936 = 0x0000807f
?abs=0xc = 0x0006a35c
?abs=0x3937 = 0x000003e0
?abs=0xc4 = 0x00000000
?abs=0xc9 = 0x00000080
?abs=0x393b = 0x000003e0
?abs=0x393c = 0x0000045f
?abs=0x6 = 0x00000000
?abs=0xe20 = 0x00000003
?abs=0x53 = 0x00000200
?abs=0x404d284 = 0x2c000000
?abs=0xe4d = 0x0007f000
?abs=0xe4e = 0x0007f004
?abs=0xde0 = 0x00000001
?abs=0x1a7ab = 0x5fd00001
?abs=0x1a7ac = 0x00000004
?abs=0x1a7cb = 0xfff00000
?abs=0x1a7cc = 0x00000007
?abs=0x1a7eb = 0xfff1ffff
?abs=0x1a7ec = 0x00000007
?abs=0x1a8f0 = 0x00000000
?abs=0x1a8ef = 0x00ffffff
?abs=0x1a8ee = 0x00000000
?abs=0x1a8f1 = 0x00200000
?abs=0x1a8f2 = 0x00201fff
?abs=0x1a8d8 = 0x003e01e7
?abs=0x1a8d9 = 0x00000000
?abs=0x1a70f = 0x0000a23c
?abs=0x1a710 = 0x00000000
?abs=0x1a709 = 0x000e0000
?abs=0x1a8f3 = 0x00001859
?abs=0x1a700 = 0x00080e01
?abs=0x1a701 = 0x00000003
?abs=0x1a702 = 0x80130009
?abs=0x1a718 = 0x00000001
?abs=0x1a71e = 0x00003fe0
?abs=0x1a740 = 0x00000001
?abs=0x1a712 = 0xffffffff
?abs=0x1a713 = 0x0000000f
?abs=0x1a714 = 0x00000000
?abs=0x1a715 = 0x00000000
?abs=0x1a716 = 0x00000000
?abs=0x1a717 = 0x00000000
?abs=0x1a741 = 0x00555407
?abs=0x1a7cd = 0x00000000
?abs=0x1a7ce = 0x00000000
?abs=0x1a7ed = 0xffffffff
?abs=0x1a7ee = 0x0000000f
?abs=0x1a742 = 0x00555407
?abs=0x1a7cf = 0x00000000
?abs=0x1a7d0 = 0x00000000
?abs=0x1a7ef = 0xffffffff
?abs=0x1a7f0 = 0x0000000f
?abs=0x1a743 = 0x00555407
?abs=0x1a7d1 = 0x00000000
?abs=0x1a7d2 = 0x00000000
?abs=0x1a7f1 = 0xffffffff
?abs=0x1a7f2 = 0x0000000f
?abs=0x1a744 = 0x00555407
?abs=0x1a7d3 = 0x00000000
?abs=0x1a7d4 = 0x00000000
?abs=0x1a7f3 = 0xffffffff
?abs=0x1a7f4 = 0x0000000f
?abs=0x1a745 = 0x00555407
?abs=0x1a7d5 = 0x00000000
?abs=0x1a7d6 = 0x00000000
?abs=0x1a7f5 = 0xffffffff
?abs=0x1a7f6 = 0x0000000f
?abs=0x1a746 = 0x00555407
?abs=0x1a7d7 = 0x00000000
?abs=0x1a7d8 = 0x00000000
?abs=0x1a7f7 = 0xffffffff
?abs=0x1a7f8 = 0x0000000f
?abs=0x1a747 = 0x00555407
?abs=0x1a7d9 = 0x00000000
?abs=0x1a7da = 0x00000000
?abs=0x1a7f9 = 0xffffffff
?abs=0x1a7fa = 0x0000000f
?abs=0x1a748 = 0x00555407
?abs=0x1a7db = 0x00000000
?abs=0x1a7dc = 0x00000000
?abs=0x1a7fb = 0xffffffff
?abs=0x1a7fc = 0x0000000f
?abs=0x1a749 = 0x00555407
?abs=0x1a7dd = 0x00000000
?abs=0x1a7de = 0x00000000
?abs=0x1a7fd = 0xffffffff
?abs=0x1a7fe = 0x0000000f
?abs=0x1a74a = 0x00555407
?abs=0x1a7df = 0x00000000
?abs=0x1a7e0 = 0x00000000
?abs=0x1a7ff = 0xffffffff
?abs=0x1a800 = 0x0000000f
?abs=0x1a74b = 0x00555407
?abs=0x1a7e1 = 0x00000000
?abs=0x1a7e2 = 0x00000000
?abs=0x1a801 = 0xffffffff
?abs=0x1a802 = 0x0000000f
?abs=0x1a74c = 0x00555407
?abs=0x1a7e3 = 0x00000000
?abs=0x1a7e4 = 0x00000000
?abs=0x1a803 = 0xffffffff
?abs=0x1a804 = 0x0000000f
?abs=0x1a74d = 0x00555407
?abs=0x1a7e5 = 0x00000000
?abs=0x1a7e6 = 0x00000000
?abs=0x1a805 = 0xffffffff
?abs=0x1a806 = 0x0000000f
?abs=0x1a74e = 0x00555407
?abs=0x1a7e7 = 0x00000000
?abs=0x1a7e8 = 0x00000000
?abs=0x1a807 = 0xffffffff
?abs=0x1a808 = 0x0000000f
?abs=0x1a74f = 0x00555407
?abs=0x1a7e9 = 0x00000000
?abs=0x1a7ea = 0x00000000
?abs=0x1a809 = 0xffffffff
?abs=0x1a80a = 0x0000000f
?abs=0x1a787 = 0xffffffff
?abs=0x1a788 = 0x0000001f
?abs=0x1a789 = 0xffffffff
?abs=0x1a78a = 0x0000001f
?abs=0x1a78b = 0xffffffff
?abs=0x1a78c = 0x0000001f
?abs=0x1a78d = 0xffffffff
?abs=0x1a78e = 0x0000001f
?abs=0x1a78f = 0xffffffff
?abs=0x1a790 = 0x0000001f
?abs=0x1a791 = 0xffffffff
?abs=0x1a792 = 0x0000001f
?abs=0x1a793 = 0xffffffff
?abs=0x1a794 = 0x0000001f
?abs=0x1a795 = 0xffffffff
?abs=0x1a796 = 0x0000001f
?abs=0x1a797 = 0xffffffff
?abs=0x1a798 = 0x0000001f
?abs=0x1a799 = 0xffffffff
?abs=0x1a79a = 0x0000001f
?abs=0x1a79b = 0xffffffff
?abs=0x1a79c = 0x0000001f
?abs=0x1a79d = 0xffffffff
?abs=0x1a79e = 0x0000001f
?abs=0x1a79f = 0xffffffff
?abs=0x1a7a0 = 0x0000001f
?abs=0x1a7a1 = 0xffffffff
?abs=0x1a7a2 = 0x0000001f
?abs=0x1a7a3 = 0xffffffff
?abs=0x1a7a4 = 0x0000001f
?abs=0x1a7a5 = 0xffffffff
?abs=0x1a7a6 = 0x0000001f
?abs=0x1a7a7 = 0xffffffff
?abs=0x1a7a8 = 0x0000001f
?abs=0x1a7a9 = 0xffffffff
?abs=0x1a7aa = 0x0000001f
?abs=0x1a708 = 0x3ffffffc
?abs=0x1a774 = 0x00f80001
?abs=0x1a762 = 0x00000000
?abs=0x1120 = 0x40310120
?abs=0x1123 = 0x00000000
?abs=0x1124 = 0x00000000
?abs=0x4048e12 = 0x000a23c0
?abs=0x4048e11 = 0x00010000
?abs=0x1121 = 0xff006090
?abs=0x1122 = 0x0000007f
?abs=0x1120 = 0xc0310120
?abs=0x1126 = 0x00401000
?abs=0x1125 = 0x00007fff
?abs=0x1124 = 0x00000000
?abs=0x1123 = 0x00000000
?abs=0x1127 = 0x100002f0
?abs=0x500ef2 = 0x00020bc0
?abs=0x117a = 0x00040000
?abs=0x1175 = 0x00000008
?abs=0x1191 = 0x00000003
?abs=0x1120 = 0x40310121
?abs=0x1120 = 0xc0310121
?abs=0x1120 = 0x40330121
?abs=0x112c = 0x00000000
?abs=0x1161 = 0x00000108
?abs=0x1629a = 0x00000000
?abs=0x16292 = 0x00000080
?abs=0x16282 = 0x0000000d
?abs=0x1629a = 0x00000000
?abs=0x16292 = 0x001ed000
?abs=0x16282 = 0x0000000e
?abs=0x1629a = 0x00000000
?abs=0x16292 = 0x00000000
?abs=0x16282 = 0x00000012
?abs=0x1629a = 0x00000000
?abs=0x16292 = 0x00000001
?abs=0x16282 = 0x00000012
?abs=0x1629a = 0x00000000
?abs=0x16292 = 0x00000000
?abs=0x16282 = 0x00000012
?abs=0x1629a = 0x00000000
?abs=0x16292 = 0x00000001
?abs=0x16282 = 0x00000012
?abs=0x1629a = 0x00000000
?abs=0x16292 = 0x00000000
?abs=0x16282 = 0x00000007
?abs=0x1629a = 0x00000000
?abs=0x16292 = 0x00000000
?abs=0x16282 = 0x00000022
?abs=0x1629a = 0x00000000
?abs=0x16292 = 0x00000004
?abs=0x16282 = 0x0000000f
?abs=0x1629a = 0x00000000
?abs=0x16292 = 0x00000000
?abs=0x16282 = 0x00000021
?abs=0x1629a = 0x00000000
?abs=0x16292 = 0x00000000
?abs=0x16282 = 0x00000006
regGCVM_CONTEXT0_PAGE_TABLE_BASE_ADDR_LO32 = 0x5fd00001
regGCVM_CONTEXT0_PAGE_TABLE_BASE_ADDR_HI32 = 0x00000004
regGCVM_CONTEXT0_PAGE_TABLE_START_ADDR_LO32 = 0xfff00000
regGCVM_CONTEXT0_PAGE_TABLE_START_ADDR_HI32 = 0x00000007
regGCVM_CONTEXT0_PAGE_TABLE_END_ADDR_LO32 = 0xfff1ffff
regGCVM_CONTEXT0_PAGE_TABLE_END_ADDR_HI32 = 0x00000007
regGCMC_VM_AGP_BASE = 0x00000000
regGCMC_VM_AGP_BOT = 0x00ffffff
regGCMC_VM_AGP_TOP = 0x00000000
regGCMC_VM_SYSTEM_APERTURE_LOW_ADDR = 0x00200000
regGCMC_VM_SYSTEM_APERTURE_HIGH_ADDR = 0x00201fff
regGCMC_VM_SYSTEM_APERTURE_DEFAULT_ADDR_LSB = 0x003e01e7
regGCMC_VM_SYSTEM_APERTURE_DEFAULT_ADDR_MSB = 0x00000000
regGCVM_L2_PROTECTION_FAULT_DEFAULT_ADDR_LO32 = 0x0000a23c
regGCVM_L2_PROTECTION_FAULT_DEFAULT_ADDR_HI32 = 0x00000000
regGCVM_L2_PROTECTION_FAULT_CNTL2 = 0x00060000
regGCMC_VM_MX_L1_TLB_CNTL = 0x00001859
regGCVM_L2_CNTL = 0x00080e01
regGCVM_L2_CNTL2 = 0x00000003
regGCVM_L2_CNTL3 = 0x80130009
regGCVM_L2_CNTL4 = 0x00000001
regGCVM_L2_CNTL5 = 0x00003fe0
regGCVM_CONTEXT0_CNTL = 0x01fffe01
regGCVM_L2_CONTEXT1_IDENTITY_APERTURE_LOW_ADDR_LO32 = 0xffffffff
regGCVM_L2_CONTEXT1_IDENTITY_APERTURE_LOW_ADDR_HI32 = 0x0000000f
regGCVM_L2_CONTEXT1_IDENTITY_APERTURE_HIGH_ADDR_LO32 = 0x00000000
regGCVM_L2_CONTEXT1_IDENTITY_APERTURE_HIGH_ADDR_HI32 = 0x00000000
regGCVM_L2_CONTEXT_IDENTITY_PHYSICAL_OFFSET_LO32 = 0x00000000
regGCVM_L2_CONTEXT_IDENTITY_PHYSICAL_OFFSET_HI32 = 0x00000000
regGCVM_CONTEXT1_CNTL = 0x01fffe07
regGCVM_CONTEXT1_PAGE_TABLE_START_ADDR_LO32 = 0x00000000
regGCVM_CONTEXT1_PAGE_TABLE_START_ADDR_HI32 = 0x00000000
regGCVM_CONTEXT1_PAGE_TABLE_END_ADDR_LO32 = 0xffffffff
regGCVM_CONTEXT1_PAGE_TABLE_END_ADDR_HI32 = 0x0000000f
regGCVM_CONTEXT2_CNTL = 0x01fffe07
regGCVM_CONTEXT2_PAGE_TABLE_START_ADDR_LO32 = 0x00000000
regGCVM_CONTEXT2_PAGE_TABLE_START_ADDR_HI32 = 0x00000000
regGCVM_CONTEXT2_PAGE_TABLE_END_ADDR_LO32 = 0xffffffff
regGCVM_CONTEXT2_PAGE_TABLE_END_ADDR_HI32 = 0x0000000f
regGCVM_CONTEXT3_CNTL = 0x01fffe07
regGCVM_CONTEXT3_PAGE_TABLE_START_ADDR_LO32 = 0x00000000
regGCVM_CONTEXT3_PAGE_TABLE_START_ADDR_HI32 = 0x00000000
regGCVM_CONTEXT3_PAGE_TABLE_END_ADDR_LO32 = 0xffffffff
regGCVM_CONTEXT3_PAGE_TABLE_END_ADDR_HI32 = 0x0000000f
regGCVM_CONTEXT4_CNTL = 0x01fffe07
regGCVM_CONTEXT4_PAGE_TABLE_START_ADDR_LO32 = 0x00000000
regGCVM_CONTEXT4_PAGE_TABLE_START_ADDR_HI32 = 0x00000000
regGCVM_CONTEXT4_PAGE_TABLE_END_ADDR_LO32 = 0xffffffff
regGCVM_CONTEXT4_PAGE_TABLE_END_ADDR_HI32 = 0x0000000f
regGCVM_CONTEXT5_CNTL = 0x01fffe07
regGCVM_CONTEXT5_PAGE_TABLE_START_ADDR_LO32 = 0x00000000
regGCVM_CONTEXT5_PAGE_TABLE_START_ADDR_HI32 = 0x00000000
regGCVM_CONTEXT5_PAGE_TABLE_END_ADDR_LO32 = 0xffffffff
regGCVM_CONTEXT5_PAGE_TABLE_END_ADDR_HI32 = 0x0000000f
regGCVM_CONTEXT6_CNTL = 0x01fffe07
regGCVM_CONTEXT6_PAGE_TABLE_START_ADDR_LO32 = 0x00000000
regGCVM_CONTEXT6_PAGE_TABLE_START_ADDR_HI32 = 0x00000000
regGCVM_CONTEXT6_PAGE_TABLE_END_ADDR_LO32 = 0xffffffff
regGCVM_CONTEXT6_PAGE_TABLE_END_ADDR_HI32 = 0x0000000f
regGCVM_CONTEXT7_CNTL = 0x01fffe07
regGCVM_CONTEXT7_PAGE_TABLE_START_ADDR_LO32 = 0x00000000
regGCVM_CONTEXT7_PAGE_TABLE_START_ADDR_HI32 = 0x00000000
regGCVM_CONTEXT7_PAGE_TABLE_END_ADDR_LO32 = 0xffffffff
regGCVM_CONTEXT7_PAGE_TABLE_END_ADDR_HI32 = 0x0000000f
regGCVM_CONTEXT8_CNTL = 0x01fffe07
regGCVM_CONTEXT8_PAGE_TABLE_START_ADDR_LO32 = 0x00000000
regGCVM_CONTEXT8_PAGE_TABLE_START_ADDR_HI32 = 0x00000000
regGCVM_CONTEXT8_PAGE_TABLE_END_ADDR_LO32 = 0xffffffff
regGCVM_CONTEXT8_PAGE_TABLE_END_ADDR_HI32 = 0x0000000f
regGCVM_CONTEXT9_CNTL = 0x01fffe07
regGCVM_CONTEXT9_PAGE_TABLE_START_ADDR_LO32 = 0x00000000
regGCVM_CONTEXT9_PAGE_TABLE_START_ADDR_HI32 = 0x00000000
regGCVM_CONTEXT9_PAGE_TABLE_END_ADDR_LO32 = 0xffffffff
regGCVM_CONTEXT9_PAGE_TABLE_END_ADDR_HI32 = 0x0000000f
regGCVM_CONTEXT10_CNTL = 0x01fffe07
regGCVM_CONTEXT10_PAGE_TABLE_START_ADDR_LO32 = 0x00000000
regGCVM_CONTEXT10_PAGE_TABLE_START_ADDR_HI32 = 0x00000000
regGCVM_CONTEXT10_PAGE_TABLE_END_ADDR_LO32 = 0xffffffff
regGCVM_CONTEXT10_PAGE_TABLE_END_ADDR_HI32 = 0x0000000f
regGCVM_CONTEXT11_CNTL = 0x01fffe07
regGCVM_CONTEXT11_PAGE_TABLE_START_ADDR_LO32 = 0x00000000
regGCVM_CONTEXT11_PAGE_TABLE_START_ADDR_HI32 = 0x00000000
regGCVM_CONTEXT11_PAGE_TABLE_END_ADDR_LO32 = 0xffffffff
regGCVM_CONTEXT11_PAGE_TABLE_END_ADDR_HI32 = 0x0000000f
regGCVM_CONTEXT12_CNTL = 0x01fffe07
regGCVM_CONTEXT12_PAGE_TABLE_START_ADDR_LO32 = 0x00000000
regGCVM_CONTEXT12_PAGE_TABLE_START_ADDR_HI32 = 0x00000000
regGCVM_CONTEXT12_PAGE_TABLE_END_ADDR_LO32 = 0xffffffff
regGCVM_CONTEXT12_PAGE_TABLE_END_ADDR_HI32 = 0x0000000f
regGCVM_CONTEXT13_CNTL = 0x01fffe07
regGCVM_CONTEXT13_PAGE_TABLE_START_ADDR_LO32 = 0x00000000
regGCVM_CONTEXT13_PAGE_TABLE_START_ADDR_HI32 = 0x00000000
regGCVM_CONTEXT13_PAGE_TABLE_END_ADDR_LO32 = 0xffffffff
regGCVM_CONTEXT13_PAGE_TABLE_END_ADDR_HI32 = 0x0000000f
regGCVM_CONTEXT14_CNTL = 0x01fffe07
regGCVM_CONTEXT14_PAGE_TABLE_START_ADDR_LO32 = 0x00000000
regGCVM_CONTEXT14_PAGE_TABLE_START_ADDR_HI32 = 0x00000000
regGCVM_CONTEXT14_PAGE_TABLE_END_ADDR_LO32 = 0xffffffff
regGCVM_CONTEXT14_PAGE_TABLE_END_ADDR_HI32 = 0x0000000f
regGCVM_CONTEXT15_CNTL = 0x01fffe07
regGCVM_CONTEXT15_PAGE_TABLE_START_ADDR_LO32 = 0x00000000
regGCVM_CONTEXT15_PAGE_TABLE_START_ADDR_HI32 = 0x00000000
regGCVM_CONTEXT15_PAGE_TABLE_END_ADDR_LO32 = 0xffffffff
regGCVM_CONTEXT15_PAGE_TABLE_END_ADDR_HI32 = 0x0000000f
regGCVM_INVALIDATE_ENG0_ADDR_RANGE_LO32 = 0xffffffff
regGCVM_INVALIDATE_ENG0_ADDR_RANGE_HI32 = 0x0000001f
regGCVM_INVALIDATE_ENG1_ADDR_RANGE_LO32 = 0xffffffff
regGCVM_INVALIDATE_ENG1_ADDR_RANGE_HI32 = 0x0000001f
regGCVM_INVALIDATE_ENG2_ADDR_RANGE_LO32 = 0xffffffff
regGCVM_INVALIDATE_ENG2_ADDR_RANGE_HI32 = 0x0000001f
regGCVM_INVALIDATE_ENG3_ADDR_RANGE_LO32 = 0xffffffff
regGCVM_INVALIDATE_ENG3_ADDR_RANGE_HI32 = 0x0000001f
regGCVM_INVALIDATE_ENG4_ADDR_RANGE_LO32 = 0xffffffff
regGCVM_INVALIDATE_ENG4_ADDR_RANGE_HI32 = 0x0000001f
regGCVM_INVALIDATE_ENG5_ADDR_RANGE_LO32 = 0xffffffff
regGCVM_INVALIDATE_ENG5_ADDR_RANGE_HI32 = 0x0000001f
regGCVM_INVALIDATE_ENG6_ADDR_RANGE_LO32 = 0xffffffff
regGCVM_INVALIDATE_ENG6_ADDR_RANGE_HI32 = 0x0000001f
regGCVM_INVALIDATE_ENG7_ADDR_RANGE_LO32 = 0xffffffff
regGCVM_INVALIDATE_ENG7_ADDR_RANGE_HI32 = 0x0000001f
regGCVM_INVALIDATE_ENG8_ADDR_RANGE_LO32 = 0xffffffff
regGCVM_INVALIDATE_ENG8_ADDR_RANGE_HI32 = 0x0000001f
regGCVM_INVALIDATE_ENG9_ADDR_RANGE_LO32 = 0xffffffff
regGCVM_INVALIDATE_ENG9_ADDR_RANGE_HI32 = 0x0000001f
regGCVM_INVALIDATE_ENG10_ADDR_RANGE_LO32 = 0xffffffff
regGCVM_INVALIDATE_ENG10_ADDR_RANGE_HI32 = 0x0000001f
regGCVM_INVALIDATE_ENG11_ADDR_RANGE_LO32 = 0xffffffff
regGCVM_INVALIDATE_ENG11_ADDR_RANGE_HI32 = 0x0000001f
regGCVM_INVALIDATE_ENG12_ADDR_RANGE_LO32 = 0xffffffff
regGCVM_INVALIDATE_ENG12_ADDR_RANGE_HI32 = 0x0000001f
regGCVM_INVALIDATE_ENG13_ADDR_RANGE_LO32 = 0xffffffff
regGCVM_INVALIDATE_ENG13_ADDR_RANGE_HI32 = 0x0000001f
regGCVM_INVALIDATE_ENG14_ADDR_RANGE_LO32 = 0xffffffff
regGCVM_INVALIDATE_ENG14_ADDR_RANGE_HI32 = 0x0000001f
regGCVM_INVALIDATE_ENG15_ADDR_RANGE_LO32 = 0xffffffff
regGCVM_INVALIDATE_ENG15_ADDR_RANGE_HI32 = 0x0000001f
regGCVM_INVALIDATE_ENG16_ADDR_RANGE_LO32 = 0xffffffff
regGCVM_INVALIDATE_ENG16_ADDR_RANGE_HI32 = 0x0000001f
regGCVM_INVALIDATE_ENG17_ADDR_RANGE_LO32 = 0xffffffff
regGCVM_INVALIDATE_ENG17_ADDR_RANGE_HI32 = 0x0000001f
regCP_DEBUG = 0x00408000
regGCVM_L2_PROTECTION_FAULT_CNTL = 0x3ffffffc
regGCVM_INVALIDATE_ENG17_REQ = 0x00f80001
regCGTT_GS_NGG_CLK_CTRL = 0x00000010
?abs=0xf086 = 0x00000010
regCPF_GCR_CNTL = 0x0000c200
regGL2C_CTRL3 = 0x00f00188
regPA_CL_ENHANCE = 0x00880007
regPA_SC_ENHANCE_3 = 0x00000008
regPA_SC_VRS_SURFACE_CNTL_1 = 0x55480100
regTA_CNTL_AUX = 0x01030000
regTCP_CNTL2 = 0x0000000a
regTCP_CNTL = 0x239c0020
regGRBM_CNTL = 0x000000ff
regGRBM_GFX_INDEX = 0x40000000
regGRBM_GFX_INDEX = 0x40000100
regGRBM_GFX_INDEX = 0xe0000000
regGRBM_GFX_CNTL = 0x00000000
regSH_MEM_CONFIG = 0x0000c00c
regGRBM_GFX_CNTL = 0x00000010
regSH_MEM_CONFIG = 0x0000c00c
regSH_MEM_BASES = 0x20001000
regGRBM_GFX_CNTL = 0x00000020
regSH_MEM_CONFIG = 0x0000c00c
regSH_MEM_BASES = 0x20001000
regGRBM_GFX_CNTL = 0x00000030
regSH_MEM_CONFIG = 0x0000c00c
regSH_MEM_BASES = 0x20001000
regGRBM_GFX_CNTL = 0x00000040
regSH_MEM_CONFIG = 0x0000c00c
regSH_MEM_BASES = 0x20001000
regGRBM_GFX_CNTL = 0x00000050
regSH_MEM_CONFIG = 0x0000c00c
regSH_MEM_BASES = 0x20001000
regGRBM_GFX_CNTL = 0x00000060
regSH_MEM_CONFIG = 0x0000c00c
regSH_MEM_BASES = 0x20001000
regGRBM_GFX_CNTL = 0x00000070
regSH_MEM_CONFIG = 0x0000c00c
regSH_MEM_BASES = 0x20001000
regGRBM_GFX_CNTL = 0x00000000
regGRBM_GFX_CNTL = 0x00000080
regSH_MEM_CONFIG = 0x0000c00c
regSH_MEM_BASES = 0x00010002
regSPI_GDBG_PER_VMID_CNTL = 0x00000008
regGRBM_GFX_CNTL = 0x00000090
regSH_MEM_CONFIG = 0x0000c00c
regSH_MEM_BASES = 0x00010002
regSPI_GDBG_PER_VMID_CNTL = 0x00000008
regGRBM_GFX_CNTL = 0x000000a0
regSH_MEM_CONFIG = 0x0000c00c
regSH_MEM_BASES = 0x00010002
regSPI_GDBG_PER_VMID_CNTL = 0x00000008
regGRBM_GFX_CNTL = 0x000000b0
regSH_MEM_CONFIG = 0x0000c00c
regSH_MEM_BASES = 0x00010002
regSPI_GDBG_PER_VMID_CNTL = 0x00000008
regGRBM_GFX_CNTL = 0x000000c0
regSH_MEM_CONFIG = 0x0000c00c
regSH_MEM_BASES = 0x00010002
regSPI_GDBG_PER_VMID_CNTL = 0x00000008
regGRBM_GFX_CNTL = 0x000000d0
regSH_MEM_CONFIG = 0x0000c00c
regSH_MEM_BASES = 0x00010002
regSPI_GDBG_PER_VMID_CNTL = 0x00000008
regGRBM_GFX_CNTL = 0x000000e0
regSH_MEM_CONFIG = 0x0000c00c
regSH_MEM_BASES = 0x00010002
regSPI_GDBG_PER_VMID_CNTL = 0x00000008
regGRBM_GFX_CNTL = 0x000000f0
regSH_MEM_CONFIG = 0x0000c00c
regSH_MEM_BASES = 0x00010002
regSPI_GDBG_PER_VMID_CNTL = 0x00000008
regGRBM_GFX_CNTL = 0x00000000
regGDS_VMID8_BASE = 0x00000000
regGDS_VMID8_SIZE = 0x00000000
regGDS_GWS_VMID8 = 0x00000000
regGDS_OA_VMID8 = 0x00000000
regGDS_VMID9_BASE = 0x00000000
regGDS_VMID9_SIZE = 0x00000000
regGDS_GWS_VMID9 = 0x00000000
regGDS_OA_VMID9 = 0x00000000
regGDS_VMID10_BASE = 0x00000000
regGDS_VMID10_SIZE = 0x00000000
regGDS_GWS_VMID10 = 0x00000000
regGDS_OA_VMID10 = 0x00000000
regGDS_VMID11_BASE = 0x00000000
regGDS_VMID11_SIZE = 0x00000000
regGDS_GWS_VMID11 = 0x00000000
regGDS_OA_VMID11 = 0x00000000
regGDS_VMID12_BASE = 0x00000000
regGDS_VMID12_SIZE = 0x00000000
regGDS_GWS_VMID12 = 0x00000000
regGDS_OA_VMID12 = 0x00000000
regGDS_VMID13_BASE = 0x00000000
regGDS_VMID13_SIZE = 0x00000000
regGDS_GWS_VMID13 = 0x00000000
regGDS_OA_VMID13 = 0x00000000
regGDS_VMID14_BASE = 0x00000000
regGDS_VMID14_SIZE = 0x00000000
regGDS_GWS_VMID14 = 0x00000000
regGDS_OA_VMID14 = 0x00000000
regGDS_VMID15_BASE = 0x00000000
regGDS_VMID15_SIZE = 0x00000000
regGDS_GWS_VMID15 = 0x00000000
regGDS_OA_VMID15 = 0x00000000
regGDS_VMID1_BASE = 0x00000000
regGDS_VMID1_SIZE = 0x00000000
regGDS_GWS_VMID1 = 0x00000000
regGDS_OA_VMID1 = 0x00000000
regGDS_VMID2_BASE = 0x00000000
regGDS_VMID2_SIZE = 0x00000000
regGDS_GWS_VMID2 = 0x00000000
regGDS_OA_VMID2 = 0x00000000
regGDS_VMID3_BASE = 0x00000000
regGDS_VMID3_SIZE = 0x00000000
regGDS_GWS_VMID3 = 0x00000000
regGDS_OA_VMID3 = 0x00000000
regGDS_VMID4_BASE = 0x00000000
regGDS_VMID4_SIZE = 0x00000000
regGDS_GWS_VMID4 = 0x00000000
regGDS_OA_VMID4 = 0x00000000
regGDS_VMID5_BASE = 0x00000000
regGDS_VMID5_SIZE = 0x00000000
regGDS_GWS_VMID5 = 0x00000000
regGDS_OA_VMID5 = 0x00000000
regGDS_VMID6_BASE = 0x00000000
regGDS_VMID6_SIZE = 0x00000000
regGDS_GWS_VMID6 = 0x00000000
regGDS_OA_VMID6 = 0x00000000
regGDS_VMID7_BASE = 0x00000000
regGDS_VMID7_SIZE = 0x00000000
regGDS_GWS_VMID7 = 0x00000000
regGDS_OA_VMID7 = 0x00000000
regGDS_VMID8_BASE = 0x00000000
regGDS_VMID8_SIZE = 0x00000000
regGDS_GWS_VMID8 = 0x00000000
regGDS_OA_VMID8 = 0x00000000
regGDS_VMID9_BASE = 0x00000000
regGDS_VMID9_SIZE = 0x00000000
regGDS_GWS_VMID9 = 0x00000000
regGDS_OA_VMID9 = 0x00000000
regGDS_VMID10_BASE = 0x00000000
regGDS_VMID10_SIZE = 0x00000000
regGDS_GWS_VMID10 = 0x00000000
regGDS_OA_VMID10 = 0x00000000
regGDS_VMID11_BASE = 0x00000000
regGDS_VMID11_SIZE = 0x00000000
regGDS_GWS_VMID11 = 0x00000000
regGDS_OA_VMID11 = 0x00000000
regGDS_VMID12_BASE = 0x00000000
regGDS_VMID12_SIZE = 0x00000000
regGDS_GWS_VMID12 = 0x00000000
regGDS_OA_VMID12 = 0x00000000
regGDS_VMID13_BASE = 0x00000000
regGDS_VMID13_SIZE = 0x00000000
regGDS_GWS_VMID13 = 0x00000000
regGDS_OA_VMID13 = 0x00000000
regGDS_VMID14_BASE = 0x00000000
regGDS_VMID14_SIZE = 0x00000000
regGDS_GWS_VMID14 = 0x00000000
regGDS_OA_VMID14 = 0x00000000
regGDS_VMID15_BASE = 0x00000000
regGDS_VMID15_SIZE = 0x00000000
regGDS_GWS_VMID15 = 0x00000000
regGDS_OA_VMID15 = 0x00000000
regRLC_CSIB_ADDR_HI = 0x00000080
regRLC_CSIB_ADDR_LO = 0x001ec000
regRLC_CSIB_LENGTH = 0x000003c0
regRLC_SRM_CNTL = 0x00000003
regCP_RB_DOORBELL_RANGE_LOWER = 0x00000458
regCP_RB_DOORBELL_RANGE_UPPER = 0x000007f8
regCP_MEC_DOORBELL_RANGE_LOWER = 0x00000000
regCP_MEC_DOORBELL_RANGE_UPPER = 0x00000450
regCP_MEC_CNTL = 0x00000000
regCP_ME_CNTL = 0x01000000
regCP_MES_CNTL = 0x40030000
regGRBM_GFX_CNTL = 0x0000000c
regCP_MES_PRGRM_CNTR_START = 0xfc001400
regCP_MES_PRGRM_CNTR_START_HI = 0x3fffffff
regGRBM_GFX_CNTL = 0x0000000d
regCP_MES_PRGRM_CNTR_START = 0xfc001400
regCP_MES_PRGRM_CNTR_START_HI = 0x3fffffff
regGRBM_GFX_CNTL = 0x00000000
regCP_MES_CNTL = 0x0c000000
regRLC_CP_SCHEDULERS = 0x000030e8
regGRBM_GFX_CNTL = 0x0000000d
regCP_HQD_VMID = 0x00000000
regCP_HQD_PQ_DOORBELL_CONTROL = 0x00000000
regCP_MQD_BASE_ADDR = 0x7fca3000
regCP_MQD_BASE_ADDR_HI = 0x00000080
regCP_MQD_CONTROL = 0x00000000
regCP_HQD_PQ_BASE = 0xff008000
regCP_HQD_PQ_BASE_HI = 0x0000007f
regCP_HQD_PQ_RPTR_REPORT_ADDR = 0x00401840
regCP_HQD_PQ_RPTR_REPORT_ADDR_HI = 0x00007fff
regCP_HQD_PQ_CONTROL = 0xd8308011
regCP_HQD_PQ_WPTR_POLL_ADDR = 0x00401860
regCP_HQD_PQ_WPTR_POLL_ADDR_HI = 0x00007fff
regCP_HQD_PQ_DOORBELL_CONTROL = 0x40000060
regCP_HQD_PERSISTENT_STATE = 0x0be05501
regCP_HQD_ACTIVE = 0x00000001
regGRBM_GFX_CNTL = 0x00000000
regSCRATCH_REG0 = 0xcafedead
